Category,Message
Aditya's,No did you check? I got his detailed message now
Aditya's,You have registered Sinco as Payee. Log in at icicibank.com and enter URN  &lt;#&gt;  to confirm. Beware of frauds. Do NOT share or disclose URN to anyone.
Aditya's,"No, I decided that only people who care about stuff vote and caring about stuff is for losers"
Aditya's,Kaiez... Enjoy ur tuition... Gee... Thk e second option sounds beta... I'll go yan jiu den msg u...
Aditya's,You have registered Sinco as Payee. Log in at icicibank.com and enter URN  &lt;#&gt;  to confirm. Beware of frauds. Do NOT share or disclose URN to anyone.
Aditya's,cool. We will have fun practicing making babies!
Aditya's,Actually getting ready to leave the house.
Aditya's,K..k..any special today?
spam,"URGENT, IMPORTANT INFORMATION FOR O2 USER. TODAY IS YOUR LUCKY DAY! 2 FIND OUT WHY LOG ONTO HTTP://WWW.URAWINNER.COM THERE IS A FANTASTIC SURPRISE AWAITING FOR YOU"
Aditya's,Then we gotta do it after that
Aditya's,"I've got ten bucks, jay is being noncomittal"
Aditya's,Where at were hungry too
Aditya's,Pls speak to that customer machan.
Aditya's,somewhere out there beneath the pale moon light someone think in of u some where out there where dreams come true... goodnite &amp; sweet dreams
Aditya's,"Wen ur lovable bcums angry wid u, dnt take it seriously.. Coz being angry is d most childish n true way of showing deep affection, care n luv!.. kettoda manda... Have nice day da."
spam,Dear U've been invited to XCHAT. This is our final attempt to contact u! Txt CHAT to 86688 150p/MsgrcvdHG/Suite342/2Lands/Row/W1J6HL LDN 18 yrs
Aditya's,So wats ur opinion abt him and how abt is character?
Aditya's,Jay is snickering and tells me that x is totally fucking up the chords as we speak
Aditya's,No..few hours before.went to hair cut .
Aditya's,No wonder... Cos i dun rem seeing a silver car... But i thk i saw a black one...
Aditya's,Lmao. Take a pic and send it to me.
Aditya's,Speak only when you feel your words are better than the silence... Gud mrng:-)
Aditya's,No. She's currently in scotland for that.
Aditya's,Do you work all this week ?
spam,Congratulations ur awarded either £500 of CD gift vouchers & Free entry 2 our £100 weekly draw txt MUSIC to 87066 TnCs www.Ldew.com 1 win150ppmx3age16
Aditya's,Lol great now im getting hungry.
Aditya's,Yes.. now only saw your message..
Aditya's,I'll be at mu in like  &lt;#&gt;  seconds
Aditya's,Ok...
Aditya's,THING R GOOD THANX GOT EXAMS IN MARCH IVE DONE NO REVISION? IS FRAN STILL WITH BOYF? IVE GOTTA INTERVIW 4 EXETER BIT WORRIED!x
Aditya's,"Tell you what, if you make a little spreadsheet and track whose idea it was to smoke to determine who ""smokes too much"" for the entire month of february, I'll come up"
spam,For sale - arsenal dartboard. Good condition but no doubles or trebles!
Aditya's,Don't look back at the building because you have no coat and i don't want you to get more sick. Just hurry home and wear a coat to the gym!!!
Aditya's,"My painful personal thought- ""I always try to keep everybody happy all the time. But nobody recognises me when i am alone"""
Aditya's,Thanks for ve lovely wisheds. You rock
Aditya's,You intrepid duo you! Have a great time and see you both soon.
Aditya's,I asked sen to come chennai and search for job.
Aditya's,Dad went out oredi...
Aditya's,"I jus hope its true that  missin me cos i'm really missin him! You haven't done anything to feel guilty about, yet."
Aditya's,Wat so late still early mah. Or we juz go 4 dinner lor. Aiya i dunno...
Aditya's,"Arms fine, how's Cardiff and uni?"
Aditya's,In fact when do you leave? I think addie goes back to school tues or wed
Aditya's,"Cool breeze... Bright sun... Fresh flower... Twittering birds... All these waiting to wish u: ""GOODMORNING &amp; HAVE A NICE DAY"" :)"
Aditya's,Ya:)going for restaurant..
Aditya's,"Its ok., i just askd did u knw tht no?"
spam,Free 1st week entry 2 TEXTPOD 4 a chance 2 win 40GB iPod or £250 cash every wk. Txt POD to 84128 Ts&Cs www.textpod.net custcare 08712405020.
Aditya's,Those ducking chinchillas
Aditya's,I am in a marriage function
Aditya's,Looks like u wil b getting a headstart im leaving here bout 2.30ish but if u r desperate for my company I could head in earlier-we were goin to meet in rummer.
Aditya's,Don‘t give a flying monkeys wot they think and I certainly don‘t mind. Any friend of mine and all that!
spam,As a registered optin subscriber ur draw 4 £100 gift voucher will be entered on receipt of a correct ans to 80062 Whats No1 in the BBC charts
Aditya's,say thanks2.
Aditya's,Msg me when rajini comes.
Aditya's,Ya! when are ü taking ure practical lessons? I start in june..
Aditya's,"That's good, because I need drugs"
Aditya's,Stupid.its not possible
Aditya's,Can ü all decide faster cos my sis going home liao..
spam,Summers finally here! Fancy a chat or flirt with sexy singles in yr area? To get MATCHED up just reply SUMMER now. Free 2 Join. OptOut txt STOP Help08714742804
Aditya's,U sleeping now.. Or you going to take? Haha.. I got spys wat.. Me online checking n replying mails lor..
spam,CLAIRE here am havin borin time & am now alone U wanna cum over 2nite? Chat now 09099725823 hope 2 C U Luv CLAIRE xx Calls£1/minmoremobsEMSPOBox45PO139WA
Aditya's,"Fighting with the world is easy, u either win or lose bt fightng with some1 who is close to u is dificult if u lose - u lose if u win - u still lose."
spam,Bought one ringtone and now getting texts costing 3 pound offering more tones etc
Aditya's,"Yalru lyfu astne chikku.. Bt innu mundhe lyf ali halla ke bilo (marriage)program edhae, so lyf is nt yet ovr chikku..ali vargu lyfu meow meow:-D"
Aditya's,Kinda. First one gets in at twelve! Aah. Speak tomo
spam,"09066362231 URGENT! Your mobile No 07xxxxxxxxx won a £2,000 bonus caller prize on 02/06/03! this is the 2nd attempt to reach YOU! call 09066362231 ASAP!"
Aditya's,Ok good then i later come find ü... C lucky i told ü to go earlier... Later pple take finish ü no more again...
Aditya's,Wat makes u thk i'll fall down. But actually i thk i'm quite prone 2 falls. Lucky my dad at home i ask him come n fetch me already.
spam,"YOU 07801543489 are guaranteed the latests Nokia Phone, a 40GB iPod MP3 player or a £500 prize! Txt word:COLLECT to No:83355! TC-LLC NY-USA 150p/Mt msgrcvd18+"
Aditya's,Your account has been refilled successfully by INR  &lt;DECIMAL&gt; . Your KeralaCircle prepaid account balance is Rs  &lt;DECIMAL&gt; . Your Transaction ID is KR &lt;#&gt; .
Aditya's,I wont touch you with out your permission.
spam,Hi its LUCY Hubby at meetins all day Fri & I will B alone at hotel U fancy cumin over? Pls leave msg 2day 09099726395 Lucy x Calls£1/minMobsmoreLKPOBOX177HP51FL
Aditya's,"7 wonders in My WORLD 7th You 6th Ur style 5th Ur smile 4th Ur Personality 3rd Ur Nature 2nd Ur SMS and 1st ""Ur Lovely Friendship""... good morning dear"
Aditya's,Take some small dose tablet for fever
Aditya's,Oh. U must have taken your REAL Valentine out shopping first.
Aditya's,"Just sent you an email – to an address with incomm in it, is that right?"
Aditya's,"Will do, you gonna be at blake's all night? I might be able to get out of here a little early"
Aditya's,"Friendship is not a game to play, It is not a word to say, It doesn\'t start on March and ends on May, It is tomorrow, yesterday, today and e"
Aditya's,"Nice. Wait...should you be texting right now? I'm not gonna pay your ticket, ya know!"
Aditya's,I'm watching lotr w my sis dis aft. So u wan 2 meet me 4 dinner at nite a not?
Aditya's,Why you keeping me away like this
Aditya's,I think its far more than that but find out. Check google maps for a place from your dorm.
Aditya's,My trip was ok but quite tiring lor. Uni starts today but it's ok 4 me cos i'm not taking any modules but jus concentrating on my final yr project.
Aditya's,Have you always been saying welp?
Aditya's,"I'm a guy, browsin is compulsory"
Aditya's,Ok...
Aditya's,Purity of friendship between two is not about smiling after reading the forwarded message..Its about smiling just by seeing the name. Gud evng musthu
Aditya's,"Sorry, I'll call later"
Aditya's,"(I should add that I don't really care and if you can't I can at least get this dude to fuck off but hey, your money if you want it)"
Aditya's,"Hello lover! How goes that new job? Are you there now? Are you happy? Do you think of me? I wake, my slave and send you a teasing kiss from across the sea"
Aditya's,I told your number to gautAditya's..
Aditya's,Tell them no need to investigate about me anywhere.
Aditya's,Ok i juz receive..
Aditya's,"Cant believe i said so many things to you this morning when all i really wanted to say was good morning, i love you! Have a beautiful morning. See you in the library later."
spam,"Your account has been credited with 500 FREE Text Messages. To activate, just txt the word: CREDIT to No: 80488 T&Cs www.80488.biz"
Aditya's,In the end she might still vomit but its okay. Not everything will come out.
Aditya's,How are you with moneY...as in to you...money aint a thing....how are you sha!
Aditya's,It has everything to do with the weather. Keep extra warm. Its a cold but nothing serious. Pls lots of vitamin c
Aditya's,Hey gals.. Anyone of u going down to e driving centre tmr?
Aditya's,I'm always on yahoo messenger now. Just send the message to me and i.ll get it you may have to send it in the mobile mode sha but i.ll get it. And will reply.
Aditya's,I'm putting it on now. It should be ready for  &lt;TIME&gt;
Aditya's,"Time n Smile r the two crucial things in our life. Sometimes time makes us to forget smile, and sometimes someone's smile makes us to forget time gud noon"
spam,"SMS. ac JSco: Energy is high, but u may not know where 2channel it. 2day ur leadership skills r strong. Psychic? Reply ANS w/question. End? Reply END JSCO"
Aditya's,Host-based IDPS for linux systems.
spam,"HOT LIVE FANTASIES call now 08707509020 Just 20p per min NTT Ltd, PO Box 1327 Croydon CR9 5WB 0870 is a national rate call"
Aditya's,Don no da:)whats you plan?
Aditya's,Ill be there on  &lt;#&gt;  ok.
Aditya's,Oh my God. I'm almost home
Aditya's,Total video converter free download type this in google search:)
spam,Thanks for the Vote. Now sing along with the stars with Karaoke on your mobile. For a FREE link just reply with SING now.
Aditya's,"Wen ur lovable bcums angry wid u, dnt take it seriously.. Coz being angry is d most childish n true way of showing deep affection, care n luv!.. kettoda manda... Have nice day da."
Aditya's,Sounds like something that someone testing me would sayy
Aditya's,When u love someone Dont make them to love u as much as u do. But Love them so much that they dont want to be loved by anyone except you... Gud nit.
Aditya's,"Pete,is this your phone still? Its Jenny from college and Leanne.what are you up to now?:)"
Aditya's,Oops sorry. Just to check that you don't mind picking me up tomo at half eight from station. Would that be ok?
Aditya's,"Hey sweet, I was wondering when you had a moment if you might come to me ? I want to send a file to someone but it won't go over yahoo for them because their connection sucks, remember when you set up that page for me to go to and download the format disc ? Could you tell me how to do that ? Or do you know some other way to download big files ? Because they can download stuff directly from the internet. Any help would be great, my prey ... *teasing kiss*"
Aditya's,Hows the cAditya'sp just leaving glasgow!
Aditya's,K:)all the best:)congrats...
Aditya's,I wonder if you'll get this text?
Aditya's,I need to come home and give you some good lovin...
spam,Our brand new mobile music service is now live. The free music player will arrive shortly. Just install on your phone to browse content from the top artists.
Aditya's,Shall i ask one thing if you dont mistake me.
Aditya's,Check wid corect speling i.e. Sarcasm
spam,"URGENT! Your Mobile No was awarded a £2,000 Bonus Caller Prize on 1/08/03! This is our 2nd attempt to contact YOU! Call 0871-4719-523 BOX95QU BT National Rate"
Aditya's,Are you angry with me. What happen dear
Aditya's,I thk u dun haf 2 hint in e forum already lor... Cos i told ron n darren is going 2 tell shuhui.
Aditya's,Yup ok thanx...
Aditya's,Hi:)cts employee how are you?
Aditya's,Pls pls find out from aunt nike.
Aditya's,"Wow ... I love you sooo much, you know ? I can barely stand it ! I wonder how your day goes and if you are well, my love ... I think of you and miss you"
Aditya's,No screaming means shouting..
Aditya's,Hey what happen de. Are you alright.
Aditya's,Should I have picked up a receipt or something earlier
Aditya's,I think chennai well settled?
Aditya's,Oh dang! I didn't mean o send that to you! Lol!
Aditya's,Unfortunately i've just found out that we have to pick my sister up from the airport that evening so don't think i'll be going out at all. We should try to go out one of th
Aditya's,Horrible bf... I now v hungry...
Aditya's,Remember on that day..
spam,You have won a Nokia 7250i. This is what you get when you win our FREE auction. To take part send Nokia to 86021 now. HG/Suite342/2Lands Row/W1JHL 16+
Aditya's,How's it feel? Mr. Your not my real Valentine just my yo Valentine even tho u hardly play!!
Aditya's,All sounds good. Fingers . Makes it difficult to type
Aditya's,Midnight at the earliest
Aditya's,You're not sure that I'm not trying to make xavier smoke because I don't want to smoke after being told I smoke too much?
Aditya's,K come to nordstrom when you're done
Aditya's,Do u konw waht is rael FRIENDSHIP Im gving yuo an exmpel: Jsut ese tihs msg.. Evrey splleing of tihs msg is wrnog.. Bt sitll yuo can raed it wihtuot ayn mitsake.. GOODNIGHT &amp; HAVE A NICE SLEEP..SWEET DREAMS..
Aditya's,Now press conference da:)
spam,"Hello from Orange. For 1 month's free access to games, news and sport, plus 10 free texts and 20 photo messages, reply YES. Terms apply: www.orange.co.uk/ow"
Aditya's,After completed degree. There is no use in joining finance.
Aditya's,"Good afternoon, my love ! Any job prospects ? Are you missing me ? What do you do ? Are you being lazy and bleak, hmmm ? Or happy and filled with my love ?"
Aditya's,Shant disturb u anymore... Jia you...
Aditya's,Bishan lar nearer... No need buy so early cos if buy now i gotta park my car...
Aditya's,"Me, i dont know again oh"
Aditya's,Dude sux for snake. He got old and raiden got buff
Aditya's,He says hi and to get your ass back to south tampa (preferably at a kegger)
Aditya's,In e msg jus now. U said thanks for gift.
Aditya's,U too...
Aditya's,Ok how you dear. Did you call chechi
Aditya's,Yeah we do totes. When u wanna?
Aditya's,Ok i found dis pierre cardin one which looks normal costs 20 its on sale.
Aditya's,Good sleep is about rhythm. The person has to establish a rhythm that the body will learn and use. If you want to know more :-)
Aditya's,Wat r u doing?
Aditya's,Message from . I am at Truro Hospital on ext. You can phone me here. as I have a phone by my side
Aditya's,"Single line with a big meaning::::: ""Miss anything 4 ur ""Best Life"" but, don't miss ur best life for anything... Gud nyt..."
Aditya's,"Just got some gas money, any chance you and the gang want to go on a grand nature adventure?"
Aditya's,Dnt worry...use ice pieces in a cloth pack.also take 2 tablets.
Aditya's,Dude just saw a parked car with its sunroof popped up. Sux
Aditya's,Get ready to put on your excellent sub face :)
Aditya's,Tmrw. Im finishing 9 doors
Aditya's,"The  &lt;#&gt; g that i saw a few days ago, the guy wants sell wifi only for  &lt;#&gt;  and with 3g for  &lt;#&gt; . That's why i blanked him."
Aditya's,I am late. I will be there at
Aditya's,"whatever, im pretty pissed off."
Aditya's,Today is ACCEPT DAY..U Accept me as? Brother Sister Lover Dear1 Best1 Clos1 Lvblefrnd Jstfrnd Cutefrnd Lifpartnr Belovd Swtheart Bstfrnd No rply means enemy
Aditya's,I dont have that much image in class.
Aditya's,No:-)i got rumour that you going to buy apartment in chennai:-)
Aditya's,Near kalainar tv office.thenampet
spam,Ur cash-balance is currently 500 pounds - to maximize ur cash-in now send GO to 86688 only 150p/msg. CC 08718720201 HG/Suite342/2Lands Row/W1J6HL
spam,SMS AUCTION - A BRAND NEW Nokia 7250 is up 4 auction today! Auction is FREE 2 join & take part! Txt NOKIA to 86021 now! HG/Suite342/2Lands Row/W1J6HL
Aditya's,My sis is catching e show in e afternoon so i'm not watching w her. So c u wan 2 watch today or tmr lor.
Aditya's,"Sounds gd... Haha... Can... Wah, u yan jiu so fast liao..."
Aditya's,No. To be nosy I guess. Idk am I over reacting if I'm freaked?
Aditya's,"Remember all those whom i hurt during days of satanic imposter in me.need to pay a price,so be it.may destiny keep me going and as u said pray that i get the mind to get over the same."
Aditya's,How to Make a girl Happy? It's not at all difficult to make girls happy. U only need to be... 1. A friend 2. Companion 3. Lover 4. Chef . . .  &lt;#&gt; . Good listener  &lt;#&gt; . Organizer  &lt;#&gt; . Good boyfriend  &lt;#&gt; . Very clean  &lt;#&gt; . Sympathetic  &lt;#&gt; . Athletic  &lt;#&gt; . Warm . . .  &lt;#&gt; . Courageous  &lt;#&gt; . Determined  &lt;#&gt; . True  &lt;#&gt; . Dependable  &lt;#&gt; . Intelligent . . .  &lt;#&gt; . Psychologist  &lt;#&gt; . Pest exterminator  &lt;#&gt; . Psychiatrist  &lt;#&gt; . Healer . .  &lt;#&gt; . Stylist  &lt;#&gt; . Driver . . Aaniye pudunga venaam..
Aditya's,"Why is that, princess? I bet the brothas are all chasing you!"
Aditya's,"I shall book chez jules for half eight, if that's ok with you?"
Aditya's,Hhahhaahahah rofl wtf nig was leonardo in your room or something
Aditya's,"Yep, at derek's house now, see you Sunday &lt;3"
Aditya's,"It's cool, let me know before it kicks off around  &lt;#&gt; , I'll be out and about all day"
Aditya's,"Sorry, I'll call later"
Aditya's,I was wondering if it would be okay for you to call uncle john and let him know that things are not the same in nigeria as they r here. That  &lt;#&gt;  dollars is 2years sent and that you know its a strain but i plan to pay back every dime he gives. Every dime so for me to expect anything from you is not practical. Something like that.
Aditya's,There are no other charges after transfer charges and you can withdraw anyhow you like
Aditya's,"Dont search love, let love find U. Thats why its called falling in love, bcoz U dont force yourself, U just fall and U know there is smeone to hold U... BSLVYL"
Aditya's,At 4. Let's go to bill millers
Aditya's,I love you. You set my soul on fire. It is not just a spark. But it is a flame. A big rawring flame. XoXo
Aditya's,"Somewhr someone is surely made 4 u. And God has decided a perfect time to make u meet dat person. . . . till den, . . . . . Enjoy ur crushes..!!!;-)"
Aditya's,That's my honeymoon outfit. :)
Aditya's,Will it help if we propose going back again tomorrow
spam,PRIVATE! Your 2003 Account Statement for shows 800 un-redeemed S. I. M. points. Call 08719899230 Identifier Code: 41685 Expires 07/11/04
Aditya's,Never blame a day in ur life. Good days give u happiness. Bad days give u experience. Both are essential in life! All are Gods blessings! good morning.:
Aditya's,Pls confirm the time to collect the cheque.
spam,As a Registered Subscriber yr draw 4 a £100 gift voucher will b entered on receipt of a correct ans. When are the next olympics. Txt ans to 80062
spam,URGENT! Your Mobile number has been awarded with a £2000 prize GUARANTEED. Call 09061790121 from land line. Claim 3030. Valid 12hrs only 150ppm
Aditya's,Daddy will take good care of you :)
Aditya's,"Yeah probably, I still gotta check out with leo"
Aditya's,K.then any other special?
Aditya's,Carlos is taking his sweet time as usual so let me know when you and patty are done/want to smoke and I'll tell him to haul ass
Aditya's,Ok pa. Nothing problem:-)
Aditya's,Have you heard about that job? I'm going to that wildlife talk again tonight if u want2come. Its that2worzels and a wizzle or whatever it is?!
Aditya's,"God picked up a flower and dippeditinaDEW, lovingly touched itwhichturnedinto u, and the he gifted tomeandsaid,THIS FRIEND IS 4U"
Aditya's,When you came to hostel.
Aditya's,Ok no prob... I'll come after lunch then...
Aditya's,Jus telling u dat i'll b leaving 4 shanghai on 21st instead so we'll haf more time 2 meet up cya...
Aditya's,Are your freezing ? Are you home yet ? Will you remember to kiss your mom in the morning? Do you love me ? Do you think of me ? Are you missing me yet ?
Aditya's,You all ready for * big day tomorrow?
Aditya's,I'll probably be around mu a lot
Aditya's,645
spam,RT-KIng Pro Video Club>> Need help? info@ringtoneking.co.uk or call 08701237397 You must be 16+ Club credits redeemable at www.ringtoneking.co.uk! Enjoy!
Aditya's,Thnx dude. u guys out 2nite?
Aditya's,Me sef dey laugh you. Meanwhile how's my darling anjie!
Aditya's,Mm i had my food da from out
Aditya's,"K, makes sense, btw carlos is being difficult so you guys are gonna smoke while I go pick up the second batch and get gas"
Aditya's,Did u download the fring app?
Aditya's,The 2 oz guy is being kinda flaky but one friend is interested in picking up $ &lt;#&gt;  worth tonight if possible
Aditya's,Friends that u can stay on fb chat with
Aditya's,"Fuck babe, I miss you sooooo much !! I wish you were here to sleep with me ... My bed is so lonely ... I go now, to sleep ... To dream of you, my love ..."
Aditya's,"Living is very simple.. Loving is also simple.. Laughing is too simple.. Winning is tooo simple.. But, being 'SIMPLE' is very difficult.. Gud nte.:-"
spam,U have a secret admirer who is looking 2 make contact with U-find out who they R*reveal who thinks UR so special-call on 09058094599
Aditya's,"Ah, well that confuses things, doesn‘t it?"
spam,500 free text msgs. Just text ok to 80488 and we'll credit your account
Aditya's,Hi Dear Call me its urgnt. I don't know whats your problem. You don't want to work or if you have any other problem at least tell me. Wating for your reply.
Aditya's,Dear how you. Are you ok?
spam,"You have been selected to stay in 1 of 250 top British hotels - FOR NOTHING! Holiday Worth £350! To Claim, Call London 02072069400. Bx 526, SW73SS"
Aditya's,Yes princess! I want to make you happy...
Aditya's,Sounds like you have many talents! would you like to go on a dinner date next week?
Aditya's,I am going to film 2day da. At 6pm. Sorry da.
Aditya's,We not watching movie already. Xy wants 2 shop so i'm shopping w her now.
Aditya's,Hello my little party animal! I just thought I'd buzz you as you were with your friends ...*grins*... Reminding you were loved and send a naughty adoring kiss
Aditya's,Yesterday its with me only . Now am going home.
spam,"Eerie Nokia tones 4u, rply TONE TITLE to 8007 eg TONE DRACULA to 8007 Titles: GHOST, ADDAMSFA, MUNSTERS, EXORCIST, TWILIGHT www.getzed.co.uk POBox36504W45WQ 150p"
Aditya's,"You have come into my life and brought the sun ..Shiny down on me, warming my heart. Putting a constant smile on my face ... Making me feel loved and cared for"
Aditya's,"No shit, but I wasn't that surprised, so I went and spent the evening with that french guy I met in town here and we fooled around a bit but I didn't let him fuck me"
spam,"0A$NETWORKS allow companies to bill for SMS, so they are responsible for their ""suppliers"", just as a shop has to give a guarantee on what they sell. B. G."
Aditya's,Great comedy..cant stop laughing da:)
spam,FreeMsg:Feelin kinda lnly hope u like 2 keep me company! Jst got a cam moby wanna c my pic?Txt or reply DATE to 82242 Msg150p 2rcv Hlp 08712317606 stop to 82242
Aditya's,"Alright, we're all set here, text the man"
Aditya's,"Hi , where are you? We're at  and they're not keen to go out i kind of am but feel i shouldn't so can we go out tomo, don't mind do you?"
Aditya's,Sleeping nt feeling well
Aditya's,U WILL SWITCH YOUR FONE ON DAMMIT!!
Aditya's,India have to take lead:)
Aditya's,I.ll post her out l8r. In class
Aditya's,Thts wat Wright Brother did to fly..
Aditya's,"Evening * v good if somewhat event laden. Will fill you in, don't you worry … Head * ok but throat * wrecked. See you at six then!"
Aditya's,If u laugh really loud.. If u talk spontaneously.. If u dont care what others feel.. U are probably with your dear &amp; best friends.. GOODEVENING Dear..:)
Aditya's,ITS A LAPTOP TAKE IT WITH YOU.
Aditya's,I dont have any of your file in my bag..i was in work when you called me.i 'll tell you if i find anything in my room.
Aditya's,I wan but too early lei... Me outside now wun b home so early... Neva mind then...
spam,"For ur chance to win a £250 cash every wk TXT: ACTION to 80608. T's&C's www.movietrivia.tv custcare 08712405022, 1x150p/wk"
Aditya's,I was at bugis juz now wat... But now i'm walking home oredi... Ü so late then reply... I oso saw a top dat i like but din buy... Where r ü now?
Aditya's,"Wishing you and your family Merry ""X"" mas and HAPPY NEW Year in advance.."
Aditya's,At 7 we will go ok na.
Aditya's,Yes I posted a couple of pics on fb. There's still snow outside too. I'm just waking up :)
Aditya's,S:-)if we have one good partnership going we will take lead:)
spam,RGENT! This is the 2nd attempt to contact U!U have WON £1250 CALL 09071512433 b4 050703 T&CsBCM4235WC1N3XX. callcost 150ppm mobilesvary. max£7. 50
Aditya's,"Yeah, where's your class at?"
Aditya's,No just send to you. Bec you in temple na.
Aditya's,"You aren't coming home between class, right? I need to work out and shower!"
spam,Hi if ur lookin 4 saucy daytime fun wiv busty married woman Am free all next week Chat now 2 sort time 09099726429 JANINExx Calls£1/minMobsmoreLKPOBOX177HP51FL
Aditya's,S but mostly not like that.
Aditya's,Ü v ma fan...
