Category,Message
Aditya's,Did u turn on the heater? The heater was on and set to &lt;#&gt; degrees.
Aditya's,Thanks for your message. I really appreciate your sacrifice. I'm not sure of the process of direct pay but will find out on my way back from the test tomorrow. I'm in class now. Do have a wonderful day.
Aditya's,"That's the trouble with classes that go well - you're due a dodgey one … Expecting mine tomo! See you for recovery, same time, same place"
spam,Free video camera phones with Half Price line rental for 12 mths and 500 cross ntwk mins 100 txts. Call MobileUpd8 08001950382 or Call2OptOut/674&
Aditya's,WOT U UP 2 J?
Aditya's,"Night night, see you tomorrow"
Aditya's,Roger that. We‘re probably going to rem in about 20
Aditya's,do u think that any girl will propose u today by seing ur bloody funky shit fucking face...............asssssholeeee................
Aditya's,I wish u were here. I feel so alone
spam,Great NEW Offer - DOUBLE Mins & DOUBLE Txt on best Orange tariffs AND get latest camera phones 4 FREE! Call MobileUpd8 free on 08000839402 NOW! or 2stoptxt T&Cs
Aditya's,Reason is if the team budget is available at last they buy the unsold players for at base rate..
Aditya's,CERI U REBEL! SWEET DREAMZ ME LITTLE BUDDY!! C YA 2MORO! WHO NEEDS BLOKES
spam,ringtoneking 84484
Aditya's,Huh i cant thk of more oredi how many pages do we have?
Aditya's,His frens go then he in lor. Not alone wif my mum n sis lor.
Aditya's,Nationwide auto centre (or something like that) on Newport road. I liked them there
Aditya's,"Hey, I missed you tm of last night as my phone was on the charge ... *smiles* ... I am meeting a friend shortly"
Aditya's,"Whatever, juliana. Do whatever you want."
Aditya's,"Friendship is not a game to play, It is not a word to say, It doesn\'t start on March and ends on May, It is tomorrow, yesterday, today and e"
spam,Ringtone Club: Gr8 new polys direct to your mobile every week !
Aditya's,"Hello. Sort of out in town already. That . So dont rush home, I am eating nachos. Will let you know eta."
Aditya's,Ok lor. Anyway i thk we cant get tickets now cos like quite late already. U wan 2 go look 4 ur frens a not? Darren is wif them now...
spam,(Bank of Granite issues Strong-Buy) EXPLOSIVE PICK FOR OUR MEMBERS *****UP OVER 300% *********** Nasdaq Symbol CDGT That is a $5.00 per..
Aditya's,I am on the way to ur home
Aditya's,"Dizzamn, aight I'll ask my suitemates when I get back"
Aditya's,"Nimbomsons. Yep phone knows that one. Obviously, cos thats a real word"
Aditya's,I love to cuddle! I want to hold you in my strong arms right now...
Aditya's,R u in this continent?
Aditya's,We'll you pay over like  &lt;#&gt; yrs so its not too difficult
spam,Bored housewives! Chat n date now! 0871750.77.11! BT-national rate 10p/min only from landlines!
spam,We tried to call you re your reply to our sms for a video mobile 750 mins UNLIMITED TEXT free camcorder Reply or call now 08000930705 Del Thurs
Aditya's,K...k...when will you give treat?
spam,"This is the 2nd time we have tried to contact u. U have won the £400 prize. 2 claim is easy, just call 087104711148 NOW! Only 10p per minute. BT-national-rate"
Aditya's,He's just gonna worry for nothing. And he won't give you money its no use.
Aditya's,Did you get any gift? This year i didnt get anything. So bad
Aditya's,somewhere out there beneath the pale moon light someone think in of u some where out there where dreams come true... goodnite &amp; sweet dreams
Aditya's,Well there's a pattern emerging of my friends telling me to drive up and come smoke with them and then telling me that I'm a weed fiend/make them smoke too much/impede their doing other things so you see how I'm hesitant
Aditya's,", ow u dey.i paid 60,400thousad.i told  u would call ."
Aditya's,IM FINE BABES AINT BEEN UP 2 MUCH THO! SAW SCARY MOVIE YEST ITS QUITE FUNNY! WANT 2MRW AFTERNOON? AT TOWN OR MALL OR SUMTHIN?xx
Aditya's,I'm reaching home in 5 min.
Aditya's,"Forgot you were working today! Wanna chat, but things are ok so drop me a text when you're free / bored etc and i'll ring. Hope all is well, nose essay and all xx"
Aditya's,Ha... Then we must walk to everywhere... Cannot take tram. My cousin said can walk to vic market from our hotel
spam,"Wan2 win a Meet+Greet with Westlife 4 U or a m8? They are currently on what tour? 1)Unbreakable, 2)Untamed, 3)Unkempt. Text 1,2 or 3 to 83049. Cost 50p +std text"
spam,Please call our customer service representative on FREEPHONE 0808 145 4742 between 9am-11pm as you have WON a guaranteed £1000 cash or £5000 prize!
Aditya's,Discussed with your mother ah?
Aditya's,Ok.
Aditya's,"Sorry, I can't text &amp; drive coherently, see you in twenty"
spam,You will be receiving this week's Triple Echo ringtone shortly. Enjoy it!
Aditya's,In which place i can get rooms cheap:-)
Aditya's,Eek that's a lot of time especially since American Pie is like 8 minutes long. I can't stop singing it.
Aditya's,GRAN ONLYFOUND OUT AFEW DAYS AGO.CUSOON HONI
spam,"U've been selected to stay in 1 of 250 top British hotels - FOR NOTHING! Holiday valued at £350! Dial 08712300220 to claim - National Rate Call. Bx526, SW73SS"
Aditya's,University of southern california.
Aditya's,We have to pick rayan macleran there.
Aditya's,U gd lor go shopping i got stuff to do. U wan 2 watch infernal affairs a not? Come lar...
Aditya's,Well. Balls. Time to make calls
Aditya's,Wat time ü wan today?
Aditya's,&lt;#&gt;  in mca. But not conform.
Aditya's,Oh ok.. Wat's ur email?
Aditya's,"Yes, princess. Are you going to make me moan?"
Aditya's,Lol its ok I didn't remember til last nite
Aditya's,"[…] anyway, many good evenings to u! s"
Aditya's,"Cool, I'll text you in a few"
Aditya's,"Sorry vikky, i'm Watching olave mandara movie kano in trishul theatre wit my frnds.."
Aditya's,I'm very happy for you babe ! Woo hoo party on dude!
Aditya's,I am taking you for italian food. How about a pretty dress with no panties? :)
Aditya's,Wot u up 2? Thout u were gonna call me!! Txt bak luv K
spam,YOU ARE CHOSEN TO RECEIVE A £350 AWARD! Pls call claim number 09066364311 to collect your award which you are selected to receive as a valued mobile customer.
Aditya's,How are you holding up?
Aditya's,Dont flatter yourself... Tell that man of mine two pints of carlin in ten minutes please....
Aditya's,Hope you are not scared!
Aditya's,I cant pick the phone right now. Pls send a message
Aditya's,I'm at home n ready...
spam,Please call our customer service representative on FREEPHONE 0808 145 4742 between 9am-11pm as you have WON a guaranteed £1000 cash or £5000 prize!
Aditya's,What time do u get out?
Aditya's,I am literally in bed and have been up for like  &lt;#&gt;  hours
Aditya's,"Yes, my reg is  Ciao!"
Aditya's,If You mean the website. Yes.
spam,Win a £1000 cash prize or a prize worth £5000
spam,"Thanks for your ringtone order, reference number X49.Your mobile will be charged 4.50. Should your tone not arrive please call customer services 09065989182"
Aditya's,Lol or I could just starve and lose a pound by the end of the day.
Aditya's,Yeah that's the impression I got
Aditya's,Ok ok take care. I can understand.
Aditya's,"Motivate Behind every darkness, there is a shining light waiting for you to find it... Behind every best friend, there is always trust and love... BSLVYL"
Aditya's,"Ya ok, then had dinner?"
Aditya's,I was slept that time.you there?
Aditya's,dont make ne plans for nxt wknd coz she wants us to come down then ok
Aditya's,When is school starting. Where will you stay. What's the weather like. And the food. Do you have a social support system like friends in the school. All these things are important.
Aditya's,"Ha ha nan yalrigu heltini..Iyo kothi chikku, u shared many things wit me..so far i didn't told any body and even uttered a word abt u.. If ur trusting me so much how can i tell these to others.. Plz nxt time dont use those words to me..ok, chikku:-);-)B-)"
Aditya's,Noice. Text me when you're here
Aditya's,Hi di is yijue we're meeting at 7 pm at esaplanade tonight.
spam,Moby Pub Quiz.Win a £100 High Street prize if u know who the new Duchess of Cornwall will be? Txt her first name to 82277.unsub STOP £1.50 008704050406 SP
spam,"This weeks SavaMob member offers are now accessible. Just call 08709501522 for details! SavaMob, POBOX 139, LA3 2WU. Only £1.50/week. SavaMob - offers mobile!"
Aditya's,"Aight I've been set free, think you could text me blake's address? It occurs to me I'm not quite as sure what I'm doing as I thought I was"
Aditya's,Hi dear we saw dear. We both are happy. Where you my battery is low
Aditya's,How are you. Its been ages. How's abj
Aditya's,Prof: you have passed in all the papers in this sem congrats . . . . Student: Enna kalaachutaarama..!! Prof:???? Gud mrng!
Aditya's,Dont kick coco when he's down
Aditya's,Fyi I'm gonna call you sporadically starting at like  &lt;#&gt;  bc we are not not doin this shit
spam,"You are being contacted by our Dating Service by someone you know! To find out who it is, call from your mobile or landline 09064017305 PoBox75LDNS7"
spam,TBS/PERSOLVO. been chasing us since Sept for£38 definitely not paying now thanks to your information. We will ignore them. Kath. Manchester.
Aditya's,Hope youre not having too much fun without me!! see u tomorrow love jess x
Aditya's,Ok i wont call or disturb any one. I know all are avoiding me. I am a burden for all
Aditya's,I've reached home n i bathe liao... U can call me now...
spam,Loans for any purpose even if you have Bad Credit! Tenants Welcome. Call NoWorriesLoans.com on 08717111821
Aditya's,Was the actual exam harder than NBME
Aditya's,A lot of this sickness thing going round. Take it easy. Hope u feel better soon. Lol
Aditya's,"God picked up a flower and dippeditinaDEW, lovingly touched itwhichturnedinto u, and the he gifted tomeandsaid,THIS FRIEND IS 4U"
spam,87077: Kick off a new season with 2wks FREE goals & news to ur mobile! Txt ur club name to 87077 eg VILLA to 87077
Aditya's,Hey sathya till now we dint meet not even a single time then how can i saw the situation sathya.
Aditya's,Gam gone after outstanding innings.
Aditya's,O i played smash bros  &lt;#&gt;  religiously.
Aditya's,"Sir, good morning. Hope you had a good weekend. I called to let you know that i was able to raise  &lt;#&gt;  from my dad. He however said he would make the rest available by mid feb. This amount is still quite short and i was hoping you would help. Do have a good day. Abiola"
Aditya's,Hurry home. Soup is DONE!
Aditya's,No no. I will check all rooms befor activities
Aditya's,"Good afternoon, my love. It was good to see your words on YM and get your tm. Very smart move, my slave ... *smiles* ... I drink my coffee and await you."
Aditya's,Quite ok but a bit ex... U better go eat smth now else i'll feel guilty...
spam,"Orange brings you ringtones from all time Chart Heroes, with a free hit each week! Go to Ringtones & Pics on wap. To stop receiving these tips reply STOP."
Aditya's,Lemme know when you're here
spam,PRIVATE! Your 2003 Account Statement for 07973788240 shows 800 un-redeemed S. I. M. points. Call 08715203649 Identifier Code: 40533 Expires 31/10/04
Aditya's,He needs to stop going to bed and make with the fucking dealing
Aditya's,"How are you, my Love ? Are you with your brother ? Time to talk english with him ? *grins* Say : Hey Muhommad, Penny says hello from across the sea"
spam,We tried to call you re your reply to our sms for a video mobile 750 mins UNLIMITED TEXT + free camcorder Reply of call 08000930705 Now
Aditya's,"Hey doc pls I want to get nice t shirt for my hubby nice fiting ones my budget is  &lt;#&gt; k help pls I will load d card abi hw,keep me posted luv. 2 mj"
Aditya's,I remain unconvinced that this isn't an elaborate test of my willpower
Aditya's,"Life is nothing wen v get everything. But ""life is everything wen v miss something "". Real value of people wil be realized only in their absence.... gud mrng"
Aditya's,how are you? I miss you!
Aditya's,I ain't answerin no phone at what is actually a pretty reasonable hour but I'm sleepy
Aditya's,"Hey , is * rite u put »10 evey mnth is that all?"
Aditya's,i am going to bed now prin
Aditya's,I think just yourself …Thanks and see you tomo
Aditya's,If u dun drive then how i go 2 sch.
Aditya's,I not at home now lei...
spam,GSOH? Good with SPAM the ladies?U could b a male gigolo? 2 join the uk's fastest growing mens club reply ONCALL. mjzgroup. 08714342399.2stop reply STOP. msg@£1.50rcvd
Aditya's,Ok then i will come to ur home after half an hour
spam,U have a secret admirer who is looking 2 make contact with U-find out who they R*reveal who thinks UR so special-call on 09058094599
Aditya's,Do u hav any frnd by name ashwini in ur college?
Aditya's,Jus finish my lunch on my way home lor... I tot u dun wan 2 stay in sch today...
Aditya's,K then 2marrow are you coming to class.
spam,"HOT LIVE FANTASIES call now 08707500020 Just 20p per min NTT Ltd, PO Box 1327 Croydon CR9 5WB 0870 is a national rate call"
Aditya's,Pls send me your address sir.
Aditya's,I want to lick your pussy now...
Aditya's,"Yo, you gonna still be in stock tomorrow/today? I'm trying to get a dubsack"
spam,URGENT! Your Mobile number has been awarded a <UKP>2000 prize GUARANTEED. Call 09061790125 from landline. Claim 3030. Valid 12hrs only 150ppm
Aditya's,"I'll see, but prolly yeah"
Aditya's,Thought we could go out for dinner. I'll treat you! Seem ok?
Aditya's,Where are you ? What do you do ? How can you stand to be away from me ? Doesn't your heart ache without me ? Don't you wonder of me ? Don't you crave me ?
Aditya's,Sorry. You never hear unless you book it. One was kinda a joke--thet were really looking for skinny white girls. The other was one line--you can only do so much on camera with that. Something like that they're casting on the look.
Aditya's,What you doing?how are you?
Aditya's,"Sure thing big man. i have hockey elections at 6, shouldn‘t go on longer than an hour though"
Aditya's,Watch lor. I saw a few swatch one i thk quite ok. Ard 116 but i need 2nd opinion leh...
Aditya's,Hiya do u like the hlday pics looked horrible in them so took mo out! Hows the camp Amrca thing? Speak soon Serena:)
Aditya's,"Babe! How goes that day ? What are you up to ? I miss you already, my Love ... * loving kiss* ... I hope everything goes well."
Aditya's,Yunny... I'm goin to be late
Aditya's,Doc prescribed me morphine cause the other pain meds aren't enough. Waiting for my mom to bring it. That med should kick in fast so I'm gonna try to be on later
Aditya's,"Cool, want me to go to kappa or should I meet you outside mu"
Aditya's,"Hey sexy buns ! Have I told you ? I adore you, loverboy. I hope you remember to thank your sister in law for those meatballs *grins* ... i love you, babe"
Aditya's,May b approve panalam...but it should have more posts..
spam,"SPJanuary Male Sale! Hot Gay chat now cheaper, call 08709222922. National rate from 1.5p/min cheap to 7.8p/min peak! To stop texts call 08712460324 (10p/min)"
Aditya's,"Sorry, I'll call later"
Aditya's,I dont thnk its a wrong calling between us
Aditya's,Me i'm not workin. Once i get job...
Aditya's,And by when you're done I mean now
Aditya's,"Its Ur luck to Love someone. Its Ur fortune to Love the one who Loves U. But, its a miracle to Love a person who can't Love anyone except U... Gud nyt..."
Aditya's,Hi baby ive just got back from work and i was wanting to see u allday! I hope i didnt piss u off on the phone today. If u are up give me a call xxx
spam,FreeMsg Today's the day if you are ready! I'm horny & live in your town. I love sex fun & games! Netcollex Ltd 08700621170150p per msg reply Stop to end
Aditya's,Is it your yahoo boys that bring in the perf? Or legal.
Aditya's,No need to say anything to me. I know i am an outsider
Aditya's,have you ever had one foot before?
Aditya's,Just got to  &lt;#&gt;
Aditya's,"Good! No, don‘t need any receipts—well done! (…) Yes, please tell . What‘s her number, i could ring her"
Aditya's,"Ever green quote ever told by Jerry in cartoon ""A Person Who Irritates u Always Is the one Who Loves u Vry Much But Fails to Express It...!..!! :-) :-) gud nyt"
Aditya's,Leave it wif me lar... Ü wan to carry meh so heavy... Is da num 98321561 familiar to ü?
Aditya's,Beautiful truth : Expression of the face could Be seen by everyone... But the depression of heart Could be understood only By the Loved ones.. Gud Ni8;-)
Aditya's,Infact happy new year. How are you where are you when are we seeing
spam,"In The Simpsons Movie released in July 2007 name the band that died at the start of the film? A-Green Day, B-Blue Day, C-Red Day. (Send A, B or C)"
Aditya's,That's a sAditya'se! Maybe cld meet for few hrs tomo?
Aditya's,Lol I would but despite these cramps I like being a girl.
Aditya's,I cant wait for cornwall. Hope tonight isnt too bad as well but its rock night shite. Anyway im going for a kip now have a good night. Speak to you soon.
Aditya's,Pls help me tell sura that i'm expecting a battery from hont. And that if should pls send me a message about how to download movies. Thanks
spam,Please call Amanda with regard to renewing or upgrading your current T-Mobile handset free of charge. Offer ends today. Tel 0845 021 3680 subject to T's and C's
Aditya's,"Haven't found a way to get another app for your phone, eh ? Will you go to the net cafe ? Did you take that job? Geeee I need you babe. I crave to see you ..."
Aditya's,I only work from mon to thurs but Sat i cant leh... Booked liao... Which other day u free?
Aditya's,Ü comin to fetch us oredi...
Aditya's,What's nannys address?
spam,"URGENT!! Your 4* Costa Del Sol Holiday or £5000 await collection. Call 09050090044 Now toClaim. SAE, TC s, POBox334, Stockport, SK38xh, Cost£1.50/pm, Max10mins"
Aditya's,Haf u eaten? Wat time u wan me 2 come?
spam,Want a new Video Phone? 750 anytime any network mins? Half price line rental free text for 3 months? Reply or call 08000930705 for free delivery
Aditya's,"Yo, call me when you get the chance, a friend of mine wanted me to ask you about a big order"
Aditya's,This single single answers are we fighting? Plus i said am broke and you didnt reply
Aditya's,It certainly puts things into perspective when something like this happens
Aditya's,Now got tv 2 watch meh? U no work today?
Aditya's,i felt so...not any conveying reason.. Ese he... What about me?
spam,Had your mobile 11 months or more? U R entitled to Update to the latest colour mobiles with camera for Free! Call The Mobile Update Co FREE on 08002986030
Aditya's,How's it going? Got any exciting karaoke type activities planned? I'm debating whether to play football this eve. Feeling lazy though.
Aditya's,I told that am coming on wednesday.
Aditya's,"Its ok, called mom instead have fun"
spam,"Dear Voucher Holder, To claim this weeks offer, at your PC please go to http://www.wtlp.co.uk/text. Ts&Cs apply."
Aditya's,Well if I'm that desperate I'll just call armand again
Aditya's,Are you at work right now ?
spam,Congrats! Nokia 3650 video camera phone is your Call 09066382422 Calls cost 150ppm Ave call 3mins vary from mobiles 16+ Close 300603 post BCM4284 Ldn WC1N3XX
Aditya's,Haven't heard anything and he's not answering my texts so I'm guessing he flaked. That said the jb is fantastic
Aditya's,"Mmmmmm ... I love you,so much, Ahmad ... I can't wait for this year to begin as every second takes me closer to being at your side. Happy New Year, my love!!"
Aditya's,Pls what's the full name of joke's school cos fees in university of florida seem to actually be  &lt;#&gt; k. Pls holla back
Aditya's,"Sorry, I'll call later"
Aditya's,Ok... But they said i've got wisdom teeth hidden inside n mayb need 2 remove.
Aditya's,And pls pls drink plenty plenty water
Aditya's,How are you doing. How's the queen. Are you going for the royal wedding
Aditya's,He's in lag. That's just the sad part but we keep in touch thanks to skype
Aditya's,Ok lor then we go tog lor...
Aditya's,Two teams waiting for some players
Aditya's,Can ü send me a copy of da report?
Aditya's,"swhrt how u dey,hope ur ok, tot about u 2day.love n miss.take care."
Aditya's,"Ok da, i already planned. I wil pick you."
spam,"Urgent! Please call 0906346330. Your ABTA complimentary 4* Spanish Holiday or £10,000 cash await collection SAE T&Cs BOX 47 PO19 2EZ 150ppm 18+"
Aditya's,"Sorry, I'll call later in meeting"
Aditya's,I just really need shit before tomorrow and I know you won't be awake before like 6
Aditya's,I'm good. Have you registered to vote?
Aditya's,"Hmm ok, i'll stay for like an hour cos my eye is really sore!"
Aditya's,Dear got bus directly to calicut
Aditya's,Mm umma ask vava also to come tell him can play later together
Aditya's,"Well the general price is  &lt;#&gt; /oz, let me know if/when/how much you want"
Aditya's,"Sorry, I'll call later"
Aditya's,"Each Moment in a day,has its own value-Morning brings hope,afternoon brings faith,Evening brings luv,Night brings rest,Wish u find them all today.Good Morning"
Aditya's,&lt;#&gt;  w jetton ave if you forgot
Aditya's,Ok i'm coming home now.
Aditya's,Can not use foreign stamps in this country.
spam,"Double mins and txts 4 6months FREE Bluetooth on Orange. Available on Sony, Nokia Motorola phones. Call MobileUpd8 on 08000839402 or call2optout/N9DX"
Aditya's,"Sorry, it's a lot of friend-of-a-friend stuff, I'm just now about to talk to the actual guy who wants to buy"
spam,FREE for 1st week! No1 Nokia tone 4 ur mob every week just txt NOKIA to 8007 Get txting and tell ur mates www.getzed.co.uk POBox 36504 W45WQ norm150p/tone 16+
spam,"Want to funk up ur fone with a weekly new tone reply TONES2U 2 this text. www.ringtones.co.uk, the original n best. Tones 3GBP network operator rates apply"
spam,"cmon babe, make me horny, *turn* me on! Txt me your fantasy now babe -) Im hot, sticky and need you now. All replies cost £1.50. 2 cancel send STOP"
Aditya's,I will come tomorrow di
Aditya's,Wylie update: my weed dealer carlos went to freedom and had a class with lunsford
Aditya's,Are you happy baby ? Are you alright ? Did you take that job ? I hope your fine. I send you a kiss to make you smile from across the sea ... *kiss* *kiss*
Aditya's,C movie is juz last minute decision mah. Juz watch 2 lar but i tot ü not interested.
Aditya's,How are you enjoying this semester? Take care brother.
spam,IMPORTANT INFORMATION 4 ORANGE USER 0796XXXXXX. TODAY IS UR LUCKY DAY!2 FIND OUT WHY LOG ONTO http://www.urawinner.com THERE'S A FANTASTIC PRIZEAWAITING YOU!
Aditya's,"Get the door, I'm here"
Aditya's,"Lets use it next week, princess :)"
Aditya's,Or i go home first lar ü wait 4 me lor.. I put down my stuff first..
Aditya's,I want kfc its Tuesday. Only buy 2 meals ONLY 2. No gravy. Only 2 Mark. 2!
Aditya's,No da:)he is stupid da..always sending like this:)don believe any of those message.pandy is a mental:)
Aditya's,Oi when you gonna ring
spam,Missed call alert. These numbers called but left no message. 07008009200
Aditya's,I attended but nothing is there.
Aditya's,Ard 530 like dat lor. We juz meet in mrt station then ü dun haf to come out.
Aditya's,No dear i was sleeping :-P
Aditya's,Er mw im filled tuth is aight
Aditya's,Will be office around 4 pm. Now i am going hospital.
Aditya's,Actually i'm waiting for 2 weeks when they start putting ad.
Aditya's,Anything lor if they all go then i go lor...
Aditya's,U free on sat rite? U wan 2 watch infernal affairs wif me n darren n mayb xy?
Aditya's,"Plz note: if anyone calling from a mobile Co. &amp; asks u to type # &lt;#&gt;  or # &lt;#&gt; . Do not do so. Disconnect the call,coz it iz an attempt of 'terrorist' to make use of the sim card no. Itz confirmd by nokia n motorola n has been verified by CNN IBN."
Aditya's,Yo you around? A friend of mine's lookin to pick up later tonight
Aditya's,Stupid auto correct on my phone
Aditya's,Double eviction this week - Spiral and Michael and good riddance to them!
Aditya's,"The world suffers a lot... Not because of the violence of bad people. But because of the silence of good people!, Gud night...."
Aditya's,"Ok thats cool. Its , just off either raglan rd or edward rd. Behind the cricket ground. Gimme ring when ur closeby see you tuesday."
Aditya's,Buy one egg for me da..please:)
Aditya's,Have you started in skye
Aditya's,Have you bookedthe hut? And also your time off? How are you by the way?
Aditya's,And several to you sir.
Aditya's,U really pig leh sleep so much. My dad wake me up at 10 smth 2 eat lunch today.
Aditya's,I'm at home. Please call
Aditya's,My love ... I hope your not doing anything drastic. Don't you dare sell your pc or your phone ...
Aditya's,Now only i reached home. . . I am very tired now. . I will come tomorro
spam,FREEMSG: Our records indicate you may be entitled to 3750 pounds for the Accident you had. To claim for free reply with YES to this msg. To opt out text STOP
spam,"U can WIN £100 of Music Gift Vouchers every week starting NOW Txt the word DRAW to 87066 TsCs www.Idew.com SkillGame, 1Winaweek, age16. 150ppermessSubscription"
Aditya's,Life style garments account no please.
Aditya's,Lol wtf random. Btw is that your lunch break
Aditya's,"Sez, hows u & de arab boy? Hope u r all good give my love 2 evry1 love ya eshxxxxxxxxxxx"
Aditya's,"The LAY MAN! Just to let you know you are missed and thought off. Do have a great day. And if you can send me bimbo and ugo's numbers, ill appreciate. Safe"
Aditya's,Detroit. The home of snow. Enjoy it.
spam,Show ur colours! Euro 2004 2-4-1 Offer! Get an England Flag & 3Lions tone on ur phone! Click on the following service message for info!
Aditya's,Okie...
Aditya's,"Aight, I'm chillin in a friend's room so text me when you're on the way"
