Category,Message
Aditya's,Thinkin about someone is all good. No drugs for that
Aditya's,"Say this slowly.? GOD,I LOVE YOU &amp; I NEED YOU,CLEAN MY HEART WITH YOUR BLOOD.Send this to Ten special people &amp; u c miracle tomorrow, do it,pls,pls do it..."
Aditya's,"Enjoy the showers of possessiveness poured on u by ur loved ones, bcoz in this world of lies, it is a golden gift to be loved truly.."
Aditya's,"Alright if you're sure, let me know when you're leaving"
Aditya's,Some are lasting as much as 2 hours. You might get lucky.
Aditya's,Genius what's up. How your brother. Pls send his number to my skype.
spam,"Gr8 Poly tones 4 ALL mobs direct 2u rply with POLY TITLE to 8007 eg POLY BREATHE1 Titles: CRAZYIN, SLEEPINGWITH, FINEST, YMCA :getzed.co.uk POBox365O4W45WQ 300p"
Aditya's,Thk some of em find wtc too far... Weiyi not goin... E rest i dunno yet... R ur goin 4 dinner den i might b able to join...
Aditya's,Don't forget who owns you and who's private property you are ... And be my good boy always .. *passionate kiss*
spam,INTERFLORA - It's not too late to order Interflora flowers for christmas call 0800 505060 to place your order before Midnight tomorrow.
Aditya's,Oh god..taken the teeth?is it paining
spam,ROMCAPspam Everyone around should be responding well to your presence since you are so warm and outgoing. You are bringing in a real breath of sunshine.
Aditya's,Then u ask darren go n pick u lor... But i oso sian tmr haf 2 meet lect...
Aditya's,No need to buy lunch for me.. I eat maggi mee..
spam,"Congratulations - Thanks to a good friend U have WON the £2,000 Xmas prize. 2 claim is easy, just call 08712103738 NOW! Only 10p per minute. BT-national-rate"
Aditya's,Ok lor...
Aditya's,"Oh right, ok. I'll make sure that i do loads of work during the day!  got a really nasty cough today and is dry n shot so that should really help it!"
Aditya's,Wife.how she knew the time of murder exactly
spam,Send a logo 2 ur lover - 2 names joined by a heart. Txt LOVE NAME1 NAME2 MOBNO eg LOVE ADAM EVE 07123456789 to 87077 Yahoo! POBox36504W45WQ TxtNO 4 no ads 150p.
Aditya's,Howz that persons story
Aditya's,Thanx 4 sending me home...
Aditya's,Its normally hot mail. Com you see!
spam,"You've won tkts to the EURO2004 CUP FINAL or £800 CASH, to collect CALL 09058099801 b4190604, POBOX 7876150ppm"
Aditya's,U sick still can go shopping?
Aditya's,"Ya they are well and fine., BBD(pooja) full pimples..even she become quite black..and ur rite here its too cold, wearing sweatter.."
Aditya's,Nice.nice.how is it working?
Aditya's,1's reach home call me.
Aditya's,Were trying to find a Chinese food place around here
Aditya's,"Easy mate, * guess the quick drink was bit ambitious."
Aditya's,BABE !!! I miiiiiiissssssssss you ! I need you !!! I crave you !!! :-( ... Geeee ... I'm so sad without you babe ... I love you ...
Aditya's,Ok thanx...
Aditya's,aathi..where are you dear..
Aditya's,"Tunji, how's the queen? how are you doing. This is just wishing you a great day. Abiola."
Aditya's,Today iZ Yellow rose day. If u love my frndship give me 1 misscall &amp; send this to ur frndZ &amp; See how many miss calls u get. If u get 6missed U marry ur Lover.
Aditya's,Will be out of class in a few hours. Sorry
Aditya's,Wat time u finish ur lect today?
spam,"Free-message: Jamster!Get the crazy frog sound now! For poly text MAD1, for real text MAD2 to 88888. 6 crazy sounds for just 3 GBP/week! 16+only! T&C's apply"
Aditya's,"Sad story of a Man - Last week was my b'day. My Wife did'nt wish me. My Parents forgot n so did my Kids . I went to work. Even my Colleagues did not wish. As I entered my cabin my PA said, '' Happy B'day Boss !!''. I felt special. She askd me 4 lunch. After lunch she invited me to her apartment. We went there. She said,'' do u mind if I go into the bedroom for a minute ? '' ''OK'', I sed in a sexy mood. She came out 5 minuts latr wid a cake...n My Wife, My Parents, My Kidz, My Friends n My Colleagues. All screaming.. SURPRISE !! and I was waiting on the sofa.. ... ..... ' NAKED...!"
spam,"YOUR CHANCE TO BE ON A REALITY FANTASY SHOW call now = 08707509020 Just 20p per min NTT Ltd, PO Box 1327 Croydon CR9 5WB 0870 is a national = rate call"
Aditya's,She's fine. Good to hear from you. How are you my dear? Happy new year oh.
Aditya's,Are you going to wipro interview today?
Aditya's,how tall are you princess?
Aditya's,I doubt you could handle 5 times per night in any case...
Aditya's,Haha... Hope ü can hear the receipt sound... Gd luck!
Aditya's,Your gonna be the death if me. I'm gonna leave a note that says its all robs fault. Avenge me.
Aditya's,"Japanese Proverb: If one Can do it, U too Can do it, If none Can do it,U must do it Indian version: If one Can do it, LET HIM DO it.. If none Can do it,LEAVE it!! And finally Kerala version: If one can do it, Stop him doing it.. If none can do it, Make a strike against it ..."
Aditya's,Today i'm not workin but not free oso... Gee... Thgt u workin at ur fren's shop ?
Aditya's,In life when you face choices Just toss a coin not becoz its settle the question But while the coin in the air U will know what your heart is hoping for. Gudni8
Aditya's,"Do you know why god created gap between your fingers..? So that, One who is made for you comes &amp; fills those gaps by holding your hand with LOVE..!"
Aditya's,I want to be there so i can kiss you and feel you next to me
Aditya's,I am not at all happy with what you saying or doing
spam,Adult 18 Content Your video will be with you shortly
Aditya's,"Ok that would b lovely, if u r sure. Think about wot u want to do, drinkin, dancin, eatin, cinema, in, out, about... Up to u! Wot about ?"
Aditya's,What I'm saying is if you haven't explicitly told nora I know someone I'm probably just not gonna bother
Aditya's,He says hi and to get your ass back to south tampa (preferably at a kegger)
Aditya's,Smith waste da.i wanna gayle.
Aditya's,"Mum, i've sent you many many messages since i got here. I just want to know that you are actually getting them. Do enjoy the rest of your day."
Aditya's,"Aight, tomorrow around  &lt;#&gt;  it is"
Aditya's,"House-Maid is the murderer, coz the man was murdered on  &lt;#&gt; th January.. As public holiday all govt.instituitions are closed,including post office..understand?"
spam,"YOUR CHANCE TO BE ON A REALITY FANTASY SHOW call now = 08707509020 Just 20p per min NTT Ltd, PO Box 1327 Croydon CR9 5WB 0870 is a national = rate call."
Aditya's,I actually did for the first time in a while. I went to bed not too long after i spoke with you. Woke up at 7. How was your night?
Aditya's,See you there!
Aditya's,I dont understand your message.
Aditya's,Crucify is c not s. You should have told me earlier.
Aditya's,"Idk. You keep saying that you're not, but since he moved, we keep butting heads over freedom vs. responsibility. And i'm tired. I have so much other shit to deal with that i'm barely keeping myself together once this gets added to it."
Aditya's,Fuck cedar key and fuck her (come over anyway tho)
Aditya's,twenty past five he said will this train have been to durAditya's already or not coz i am in a reserved seat
spam,"Hey Boys. Want hot XXX pics sent direct 2 ur phone? Txt PORN to 69855, 24Hrs free and then just 50p per day. To stop text STOPBCM SF WC1N3XX"
Aditya's,U still painting ur wall?
spam,"Last Chance! Claim ur £150 worth of discount vouchers today! Text SHOP to 85023 now! SavaMob, offers mobile! T Cs SavaMob POBOX84, M263UZ. £3.00 Sub. 16"
Aditya's,Printer is cool. I mean groovy. Wine is groovying
Aditya's,Hi Harish's rent has been transfred to ur Acnt.
Aditya's,Anything lor is she coming?
Aditya's,Cbe is really good nowadays:)lot of shop and showrooms:)city is shaping good.
Aditya's,Ü still attending da talks?
Aditya's,No probs hon! How u doinat the mo?
Aditya's,K I'll take care of it
Aditya's,I take it we didn't have the phone callon Friday. Can we assume we won't have it this year now?
Aditya's,My battery is low babe
Aditya's,Shuhui has bought ron's present it's a swatch watch...
Aditya's,"Yeah there's quite a bit left, I'll swing by tomorrow when I get up"
Aditya's,Babe? You said 2 hours and it's been almost 4 ... Is your internet down ?
Aditya's,K I'll be sure to get up before noon and see what's what
Aditya's,K...k...yesterday i was in cbe .
Aditya's,Went to ganesh dress shop
spam,"pdate_Now - Double mins and 1000 txts on Orange tariffs. Latest Motorola, SonyEricsson & Nokia & Bluetooth FREE! Call MobileUpd8 on 08000839402 or call2optout/!YHL"
Aditya's,Ü collecting ur laptop then going to configure da settings izzit?
Aditya's,If you r @ home then come down within 5 min
Aditya's,"Aight, I should be there by 8 at the latest, probably closer to 7. Are jay and tyler down or should we just do two trips?"
Aditya's,Come aftr  &lt;DECIMAL&gt; ..now i m cleaning the house
spam,Ur cash-balance is currently 500 pounds - to maximize ur cash-in now send CASH to 86688 only 150p/msg. CC: 08718720201 PO BOX 114/14 TCR/W1
Aditya's,"Bill, as in: Are there any letters for me. i’m expecting one from orange that isn’t a bill but may still say orange on it."
Aditya's,Tell me pa. How is pain de.
Aditya's,HI DARLIN I HOPE YOU HAD A NICE NIGHT I WISH I HAD COME CANT WAIT TO SEE YOU LOVE FRAN PS I WANT DIRTY ANAL SEX AND I WANT A 10 MAN GANG BANG
Aditya's,"Ha. You don‘t know either. I did a a clever but simple thing with pears the other day, perfect for christmas."
Aditya's,"Helloooo... Wake up..! ""Sweet"" ""morning"" ""welcomes"" ""You"" ""Enjoy"" ""This Day"" ""with full of joy"".. ""GUD MRNG""."
Aditya's,ALRITE
Aditya's,Why must we sit around and wait for summer days to celebrate. Such a magical sight when the worlds dressed in white. Oooooh let there be snow.
spam,URGENT! Your Mobile number has been awarded with a £2000 prize GUARANTEED. Call 09058094454 from land line. Claim 3030. Valid 12hrs only
Aditya's,How do you guys go to see movies on your side.
Aditya's,"Sorry,in meeting I'll call later"
Aditya's,You didn't have to tell me that...now i'm thinking. Plus he's going to stop all your runs
Aditya's,Kindly send some one to our flat before  &lt;DECIMAL&gt;  today.
spam,Sorry! U can not unsubscribe yet. THE MOB offer package has a min term of 54 weeks> pls resubmit request after expiry. Reply THEMOB HELP 4 more info
Aditya's,Nothing lor... A bit bored too... Then y dun u go home early 2 sleep today...
Aditya's,What time should I tell my friend to be around?
Aditya's,Yes. that will be fine. Love you. Be safe.
Aditya's,Thanks chikku..:-) gud nyt:-*
Aditya's,Is xy in ur car when u picking me up?
Aditya's,"Thanx 4 the time weve spent 2geva, its bin mint! Ur my Baby and all I want is u!xxxx"
Aditya's,"Yo, any way we could pick something up tonight?"
Aditya's,I've not sent it. He can send me.
Aditya's,Fine am simply sitting.
Aditya's,Thts god's gift for birds as humans hav some natural gift frm god..
Aditya's,Are you coming to day for class.
Aditya's,Im done. Just studyn in library
Aditya's,Ok... U enjoy ur shows...
Aditya's,Anything...
Aditya's,Where wuld I be without my baby? The thought alone mite break me and I dont wanna go crazy but everyboy needs his lady xxxxxxxx
Aditya's,Wat's my dear doing? Sleeping ah?
Aditya's,Hi' Test on  &lt;#&gt; rd ....
Aditya's,Only 2% students solved this CAT question in 'xam... 5+3+2= &lt;#&gt;  9+2+4= &lt;#&gt;  8+6+3= &lt;#&gt;  then 7+2+5=????? Tell me the answer if u r brilliant...1thing.i got d answr.
Aditya's,Yo do you know anyone  &lt;#&gt;  or otherwise able to buy liquor? Our guy flaked and right now if we don't get a hold of somebody its just 4 loko all night
Aditya's,Yup n her fren lor. I'm meeting my fren at 730.
Aditya's,"Yeah, we got one lined up for us"
Aditya's,"And stop wondering ""wow is she ever going to stop tm'ing me ?!"" because I will tm you whenever I want because you are MINE ... *laughs*"
Aditya's,Lol yep did that yesterday. Already got my fireplace. Now its just another icon sitting there for me.
Aditya's,Hey i've booked the pilates and yoga lesson already... Haha
Aditya's,Are you ok. What happen to behave like this
spam,You have 1 new message. Please call 08712400200.
Aditya's,My supervisor find 4 me one lor i thk his students. I havent ask her yet. Tell u aft i ask her.
Aditya's,"Hello. No news on job, they are making me wait a fifth week! Yeah im up for some woozles and weasels... In exeter still, but be home about 3."
Aditya's,No message..no responce..what happend?
spam,We currently have a message awaiting your collection. To collect your message just call 08718723815.
Aditya's,"Hey babe, sorry i didn't get sooner. Gary can come and fix it cause he thinks he knows what it is but he doesn't go as far a Ptbo and he says it will cost  &lt;#&gt;  bucks. I don't know if it might be cheaper to find someone there ? We don't have any second hand machines at all right now, let me know what you want to do babe"
Aditya's,make that 3! 4 fucks sake?! x
Aditya's,Leave it. U will always be ignorant.
Aditya's,Nope but i'll b going 2 sch on fri quite early lor cos mys sis got paper in da morn :-)
Aditya's,at bruce b downs &amp; fletcher now
Aditya's,Where are you ? You said you would be here when I woke ... :-(
Aditya's,Hey now am free you can call me.
Aditya's,Tell me whos this pls:-)
spam,"URGENT! Your mobile was awarded a £1,500 Bonus Caller Prize on 27/6/03. Our final attempt 2 contact U! Call 08714714011"
Aditya's,"Think i might have to give it a miss. Am teaching til twelve, then have lecture at two. Damn this working thing."
Aditya's,Id have to check but there's only like 1 bowls worth left
Aditya's,Yes there were many sweets
Aditya's,I would but I'm still cozy. And exhausted from last night.nobody went to school or work. Everything is closed.
spam,U have a secret admirer. REVEAL who thinks U R So special. Call 09065174042. To opt out Reply REVEAL STOP. 1.50 per msg recd. Cust care 07821230901
Aditya's,Buzzzz! *grins* Did I buzz your ass? Buzz your chest ? Buzz your cock ? Where do you keep your phone ? Is the vibrator on ? Did you feel it shake ?
Aditya's,Sir send to group mail check it.
Aditya's,I'm doing da intro covers energy trends n pros n cons... Brief description of nuclear fusion n oso brief history of iter n jet got abt 7 n half pages..
Aditya's,NONE!NOWHERE IKNO DOESDISCOUNT!SHITINNIT
Aditya's,You dont know you jabo me abi.
spam,"Do you ever notice that when you're driving, anyone going slower than you is an idiot and everyone driving faster than you is a maniac?"
Aditya's,Not yet had..ya sapna aunty manege y'day hogidhe..chinnu full weak and swalpa black agidhane..
Aditya's,"Are you being good, baby? :)"
Aditya's,NEFT Transaction with reference number  &lt;#&gt;  for Rs. &lt;DECIMAL&gt;  has been credited to the beneficiary account on  &lt;#&gt;  at  &lt;TIME&gt; : &lt;#&gt;
Aditya's,"Mostly sports type..lyk footbl,crckt.."
Aditya's,Ma head dey swell oh. Thanks for making my day
Aditya's,U should make a fb list
Aditya's,"Height of Confidence: All the Aeronautics professors wer calld &amp; they wer askd 2 sit in an aeroplane. Aftr they sat they wer told dat the plane ws made by their students. Dey all hurried out of d plane.. Bt only 1 didnt move... He said:""if it is made by my students,this wont even start........ Datz confidence.."
Aditya's,Sary just need Tim in the bollox &it hurt him a lot so he tol me!
Aditya's,Happy New Year Princess!
Aditya's,"I'll text carlos and let you know, hang on"
Aditya's,"Don't worry, * is easy once have ingredients!"
Aditya's,I love u 2 my little pocy bell I am sorry but I love u
Aditya's,"Ok omw now, you at castor?"
Aditya's,Yar lor... Keep raining non stop... Or u wan 2 go elsewhere?
spam,"Xmas Offer! Latest Motorola, SonyEricsson & Nokia & FREE Bluetooth or DVD! Double Mins & 1000 Txt on Orange. Call MobileUpd8 on 08000839402 or call2optout/4QF2"
Aditya's,What u mean u almost done? Done wif sleeping? But i tot u going to take a nap.. Yup i send her liao so i'm picking her up at ard 4 smth lor..
Aditya's,"7 wonders in My WORLD 7th You 6th Ur style 5th Ur smile 4th Ur Personality 3rd Ur Nature 2nd Ur SMS and 1st ""Ur Lovely Friendship""... good morning dear"
Aditya's,"Tonight? Yeah, I'd be down for that"
Aditya's,What should i eat fo lunch senor
Aditya's,"He said that he had a right giggle when he saw u again! You would possibly be the first person2die from NVQ, but think how much you could for!"
Aditya's,No break time one... How... I come out n get my stuff fr ü?
spam,Reply to win £100 weekly! What professional sport does Tiger Woods play? Send STOP to 87239 to end service
Aditya's,"I'm there and I can see you, but you can't see me ? Maybe you should reboot ym ? I seen the buzz"
Aditya's,Do you still have the grinder?
spam,No 1 POLYPHONIC tone 4 ur mob every week! Just txt PT2 to 87575. 1st Tone FREE ! so get txtin now and tell ur friends. 150p/tone. 16 reply HL 4info
Aditya's,"Love isn't a decision, it's a feeling. If we could decide who to love, then, life would be much simpler, but then less magical"
spam,"HOT LIVE FANTASIES call now 08707509020 Just 20p per min NTT Ltd, PO Box 1327 Croydon CR9 5WB 0870 is a national rate call"
Aditya's,K.i did't see you.:)k:)where are you now?
Aditya's,So i'm doing a list of buyers.
Aditya's,"No idea, I guess we'll work that out an hour after we're supposed to leave since as usual nobody has any interest in figuring shit out before the last second"
Aditya's,Mm not entirely sure i understood that text but hey. Ho. Which weekend?
Aditya's,They released vday shirts and when u put it on it makes your bottom half naked instead of those white underwear.
Aditya's,Don know..he is watching film in computer..
Aditya's,No b4 Thursday
Aditya's,"Oh, then your phone phoned me but it disconnected"
Aditya's,Id onluy matters when getting on from offcampus
spam,This message is free. Welcome to the new & improved Sex & Dogging club! To unsubscribe from this service reply STOP. msgs@150p 18+only
Aditya's,"Excellent, I'll see what riley's plans are"
Aditya's,I will see in half an hour
spam,"You've won tkts to the EURO2004 CUP FINAL or £800 CASH, to collect CALL 09058099801 b4190604, POBOX 7876150ppm"
Aditya's,Ew are you one of them?
Aditya's,Also hi wesley how've you been
Aditya's,Ah you see. You have to be in the lingo. I will let you know wot on earth it is when has finished making it!
spam,"Loan for any purpose £500 - £75,000. Homeowners + Tenants welcome. Have you been previously refused? We can still help. Call Free 0800 1956669 or text back 'help'"
spam,Update_Now - 12Mths Half Price Orange line rental: 400mins...Call MobileUpd8 on 08000839402 or call2optout=J5Q
Aditya's,Imagine Life WITHOUT ME... see.. How fast u are searching me?Don't worry.. l'm always there To disturb U.. Goodnoon..:)
Aditya's,"Hm good morning, headache anyone? :-)"
Aditya's,Yeah no probs - last night is obviously catching up with you... Speak soon
spam,FREE UNLIMITED HARDCORE PORN direct 2 your mobile Txt PORN to 69200 & get FREE access for 24 hrs then chrgd@50p per day txt Stop 2exit. This msg is free
Aditya's,I might go 2 sch. Yar at e salon now v boring.
Aditya's,&lt;#&gt;  mins but i had to stop somewhere first.
Aditya's,"&lt;#&gt;  is fast approaching. So, Wish u a very Happy New Year Happy Sankranti Happy republic day Happy Valentines Day Happy Shivratri Happy Ugadi Happy Fools day Happy May Day Happy Independence Day, Happy Friendship,Mother,Father,Teachers,Childrens Day, &amp; HAPPY BIRTHDAY 4 U. Happy Ganesh festival Happy Dasara Happy Diwali Happy Christmas  &lt;#&gt;  Good Mornings Afternoons, Evenings Nights. RememberI AM the first to WISHING U ALL THESE...your's Raj"
Aditya's,One of the joys in lifeis waking up each daywith thoughts that somewhereSomeone cares enough tosend a warm morning greeting.. -
Aditya's,I didn't get the second half of that message
Aditya's,Wat time do u wan 2 meet me later?
Aditya's,I thank you so much for all you do with selflessness. I love you plenty.
Aditya's,Am in film ill call you later.
Aditya's,How dare you change my ring
Aditya's,You are a very very very very bad girl. Or lady.
Aditya's,I love ya too but try and budget your money better babe. Gary would freak on me if he knew
Aditya's,"What part of ""don't initiate"" don't you understand"
Aditya's,I finished my lunch already. U wake up already?
Aditya's,You still at the game?
Aditya's,You have got tallent but you are wasting.
Aditya's,What is your record for one night? :)
Aditya's,"Also sir, i sent you an email about how to log into the usc payment portal. I.ll send you another message that should explain how things are back home. Have a great weekend."
Aditya's,gonna let me know cos comes bak from holiday that day.  is coming. Don't4get2text me  number.
Aditya's,Jokin only lar... :-) depends on which phone my father can get lor...
Aditya's,"Aight, lemme know what's up"
Aditya's,Get ready for  &lt;#&gt;  inches of pleasure...
Aditya's,Raji..pls do me a favour. Pls convey my Birthday wishes to Nimya. Pls. Today is her birthday.
Aditya's,;-) ok. I feel like john lennon.
Aditya's,Cos darren say ü considering mah so i ask ü...
Aditya's,You are not bothering me but you have to trust my answers. Pls.
Aditya's,"Wishing you and your family Merry ""X"" mas and HAPPY NEW Year in advance.."
Aditya's,One day a crab was running on the sea shore..The waves came n cleared the footprints of the crab.. Crab asked: being my frnd y r u clearing my beautiful footprints? Waves replied: A fox was following ur footprints to catch you! thats y i cleared it off:) frndsship never lets u dwn :-) GUD nyt..
Aditya's,Aight what time you want me to come up?
Aditya's,Slaaaaave ! Where are you ? Must I summon you to me all the time now ? Don't you wish to come to me on your own anymore?
Aditya's,Your bill at 3 is £33.65 so thats not bad!
Aditya's,Let me know how it changes in the next 6hrs. It can even be appendix but you are out of that age range. However its not impossible. So just chill and let me know in 6hrs
Aditya's,"Hello, yeah i've just got out of the bath and need to do my hair so i'll come up when i'm done, yeah?"
Aditya's,So how's the weather over there?
Aditya's,"Ok. Not much to do here though. H&M Friday, cant wait. Dunno wot the hell im gonna do for another 3 weeks! Become a slob- oh wait, already done that!"
Aditya's,Die... Now i have e toot fringe again...
Aditya's,Lol they don't know about my awesome phone. I could click delete right now if I want.
Aditya's,Ok
Aditya's,"Awesome question with a cute answer: Someone asked a boy ""how is ur life?"" . . He smiled &amp; answered: . . ""She is fine!"" Gudnite"
Aditya's,Please leave this topic..sorry for telling that..
Aditya's,Pls send me the correct name da.
Aditya's,What happened to our yo date?
spam,EASTENDERS TV Quiz. What FLOWER does DOT compare herself to? D= VIOLET E= TULIP F= LILY txt D E or F to 84025 NOW 4 chance 2 WIN £100 Cash WKENT/150P16+
Aditya's,Webpage s not available!
Aditya's,Just woke up. Yeesh its late. But I didn't fall asleep til &lt;#&gt; am :/
spam,You are now unsubscribed all services. Get tons of sexy babes or hunks straight to your phone! go to http://gotbabes.co.uk. No subscriptions.
Aditya's,"Dear all, as we know  &lt;#&gt; th is the  &lt;#&gt; th birthday of our loving Gopalettan. We are planning to give a small gift on that day. Those who like to participate in that you are welcome. Please contact our admin team for more details"
Aditya's,K..k...from tomorrow onwards started ah?
Aditya's,What u talking bout early morning? It's almost noon where your at!
Aditya's,Fine. Do you remember me.
spam,"Hi babe its Jordan, how r u? Im home from abroad and lonely, text me back if u wanna chat xxSP visionsms.com Text stop to stopCost 150p 08712400603"
Aditya's,Ok. How many should i buy.
Aditya's,"Sounds good, keep me posted"
spam,Get a brand new mobile phone by being an agent of The Mob! Plus loads more goodies! For more info just text MAT to 87021.
Aditya's,Ok. So april. Cant wait
Aditya's,Boy you best get yo ass out here quick
Aditya's,Ay wana meet on sat?ü wkg on sat?
Aditya's,I'm now but have to wait till 2 for the bus to pick me.
Aditya's,Apart from the one i told you about yesterday?
Aditya's,Ok lor... But buy wat?
Aditya's,Somebody should go to andros and steal ice
Aditya's,Don know. I did't msg him recently.
Aditya's,Take us out shopping and Mark will distract Isaiah.=D
Aditya's,"Mum, hope you are having a great day. Hoping this text meets you well and full of life. Have a great day. Abiola"
Aditya's,There is no sense in my foot and penis.
Aditya's,Okay but i thought you were the expert
Aditya's,*deep sigh* ... I miss you :-( ... I am really surprised you haven't gone to the net cafe yet to get to me ... Don't you miss me?
Aditya's,S.s:)i thinl role is like sachin.just standing. Others have to hit.
Aditya's,Have a great trip to India. And bring the light to everyone not just with the project but with everyone that is lucky to see you smile. Bye. Abiola
Aditya's,"And very importantly, all we discuss is between u and i only."
Aditya's,K..k:)how about your training process?
Aditya's,Ok lor. I ned 2 go toa payoh 4 a while 2 return smth u wan 2 send me there or wat?
Aditya's,In da car park
Aditya's,I wish that I was with you. Holding you tightly. Making you see how important you are. How much you mean to me ... How much I need you ... In my life ...
Aditya's,So i asked how's anthony. Dad. And your bf
Aditya's,"Wnevr i wana fal in luv vth my books, My bed fals in luv vth me..!'' . Yen madodu, nav pretsorginta, nammanna pretsovru important alwa....!!:) Gud eveB-)."
Aditya's,What Today-sunday..sunday is holiday..so no work..
Aditya's,Am going to take bath ill place the key in window:-)
